class,ingredients_string,name,url,ingredients_proper
Indian,"2 cups cubed paneer (Indian cheese curd) 1/4 cup cornstarch, or as needed 1/4 cup vegetable oil 4 cloves garlic, minced 1 (1 inch) piece fresh ginger, grated 1 onion, chopped 4 green chile peppers, halved 1 bell pepper, diced Gravy: 2 tablespoons soy sauce 2 tablespoons chile sauce 2 tablespoons tomato sauce 1 teaspoon white sugar 1/2 teaspoon salt, or to taste 2 tablespoons water, or as needed (optional) 1/4 cup chopped fresh cilantro, or to taste",Chili Paneer,https://www.allrecipes.com/recipe/246254/chili-paneer/,paneer cheese curd cornstarch oil clove ginger onion chili pepper pepper sugar salt cilantro
Indian,"2 cups basmati rice 2 tablespoons canola oil 1 onion, minced 1 1/2 tablespoons minced fresh ginger 1 teaspoon cumin seeds 1 teaspoon ground fenugreek 1/4 teaspoon ground turmeric 4 garlic cloves, minced 1 cup frozen peas 1 carrot, minced 1/2 cup minced green beans 1/2 cup minced cauliflower 3 1/2 cups vegetable broth",Vegetable Pulao,https://www.allrecipes.com/recipe/246257/vegetable-pulao/,rice oil onion ginger cumin seed clove pea carrot bean
Indian,"1 large onion, quartered 15 cloves garlic 3 tablespoons vegetable oil 5 cups chopped red amaranth leaves, with their stems 2 pods green tamarind 5 teaspoons red chile powder, or to taste 1/2 teaspoon ground turmeric 1/2 cup water 1 teaspoon butter Seasoning: 1 tablespoon vegetable oil 2 red chile peppers, halved, or more to taste 2 sprigs fresh curry leaves 2 cloves garlic, chopped 1 teaspoon mustard seeds",South Indian Red Amaranth With Onions And Garlic,https://www.allrecipes.com/recipe/246071/south-indian-red-amaranth-with-onions-and-garlic/,onion clove oil butter seasoning oil chili pepper sprig clove mustard seed
Indian,"Marinade: 10 black peppercorns 6 whole cloves 5 cardamom pods 2 cinnamon sticks 2 whole star anise pods 1/2 teaspoon kala jeera (black cumin seeds) 1 bunch fresh cilantro leaves 1 bunch fresh mint leaves 1 cup plain yogurt 2 teaspoons lemon juice 2 teaspoons ginger-garlic paste 2 teaspoons chile powder 1 teaspoon biryani masala powder (such as Dunya(R)) 1/4 teaspoon ground turmeric 1 pound chicken thighs Biryani: 3 1/2 cups water 2 1/3 cups basmati rice 4 bay leaves, divided 1/2 cup warm milk 1 pinch saffron threads 1/4 cup ghee (clarified butter), divided 2 onions, thinly sliced",Hyderabad Dum Biryani,https://www.allrecipes.com/recipe/246558/hyderabad-dum-biryani/,marinade peppercorn clove cardamom cinnamon anise cumin cumin seed cilantro mint juice biryani dunya chicken biryani rice bay milk saffron ghee butter onion
Indian,"6 cups water 1 1/2 cups split black lentils 1/2 small onion, chopped 2 cloves garlic, chopped 2 teaspoons white sugar 2 teaspoons kosher salt 2 teaspoons curry powder, or more to taste 1 teaspoon turmeric powder 1 (1 inch) piece fresh ginger root, chopped",Slow Cooker Mild Curry Split Black Lentils,https://www.allrecipes.com/recipe/246347/slow-cooker-mild-curry-split-black-lentils/,onion clove sugar salt ginger root
Indian,"2 tablespoons mustard oil 1 pound okra, cut into 1/4-inch pieces 5 cloves garlic, minced, or more to taste 1 teaspoon cumin seeds 1 large red onion, thinly sliced 1 1/2 teaspoons diced ginger 1 teaspoon ground turmeric 1 teaspoon garam masala 2 tomatoes, diced 1/2 teaspoon amchoor (dried mango powder) salt to taste",Bhindi Subzi Okra Stir Fry,https://www.allrecipes.com/recipe/246711/bhindi-subzi-okra-stir-fry/,oil okra clove cumin onion ginger garam amchur mango salt
Indian,"1 cup oil for frying, or as needed 2 cups okra, cut into bite-size pieces 2 tablespoons vegetable oil 1 cup diced onion 1 teaspoon salt, or to taste 1 green chile pepper, chopped 1/2 teaspoon ginger paste 1/2 teaspoon garlic paste 1 pinch ground turmeric 1 cup diced fresh tomatoes 2 teaspoons ground coriander 2 teaspoons ground cumin 1/2 teaspoon cayenne powder 2 cups chopped bell peppers (yellow, green, red) 1 cup chopped fresh cilantro (coriander)",Kadai Bhindi Indian Style Okra With Bell Peppers,https://www.allrecipes.com/recipe/246712/kadai-bhindi-indian-style-okra-with-bell-peppers/,oil oil onion salt chili pepper ginger cayenne pepper cilantro coriander
Indian,"oil for frying 1 3/4 pounds okra, trimmed and halved lengthwise 3 tomatoes, quartered 1 (1/2 inch) piece fresh ginger 3 tablespoons vegetable oil 1 teaspoon cumin seeds 1 1/2 teaspoons salt 1 teaspoon ground red chile pepper 1/2 teaspoon ground turmeric 1/4 teaspoon dried mango powder (amchoor) 1/4 teaspoon ground coriander 1/4 teaspoon garam masala 2 tablespoons plain yogurt",La Jawab Sabut Bhindi,https://www.allrecipes.com/recipe/246713/la-jawab-sabut-bhindi/,oil ginger oil cumin amchur coriander garam yogurt
Middle_eastern,"1 1/2 pounds lean ground beef 1 medium onion, grated 1/2 cup finely chopped fresh parsley 1/4 teaspoon cayenne pepper 1/4 teaspoon ground allspice 1 teaspoon salt, or to taste 1/4 teaspoon black pepper",Kafta,https://www.allrecipes.com/recipe/64519/kafta/,beef onion parsley cayenne salt pepper
Middle_eastern,"1 clove garlic 1 (19 ounce) can garbanzo beans, half the liquid reserved 4 tablespoons lemon juice 2 tablespoons tahini 1 clove garlic, chopped 1 teaspoon salt black pepper to taste",Real Hummus,https://www.allrecipes.com/recipe/26921/real-hummus/,clove garlic bean juice clove garlic salt pepper
Middle_eastern,1 large eggplant 1 head garlic 1 tablespoon refined olive oil 2 tablespoons lemon juice 2 tablespoons tahini 1 teaspoon Splenda(R) (optional),Baba Ghanoush,https://www.allrecipes.com/recipe/81603/baba-ghanoush/,oil juice splenda
Middle_eastern,"4 leaves Swiss chard, stalks discarded and leaves cut into wide ribbons 2 stalks celery, leaves removed and chopped and stalks cut into 1/4-inch slices 2 small zucchini, quartered lengthwise and thickly sliced 2 small carrots, peeled and sliced into rounds 1 large potato, peeled and cut into cubes 1 head garlic, cloves peeled and lightly smashed 9 tablespoons lemon juice 1 tablespoon white sugar (optional) 1 tablespoon salt",Hamusta Soup,https://www.allrecipes.com/recipe/242254/hamusta-soup/,chard stalk stalk celery zucchini lengthwise carrot potato garlic clove juice sugar salt
Middle_eastern,"2 cups plain yogurt 1/4 cup distilled white vinegar 1/4 cup olive oil 3 tablespoons lemon juice 3 cloves garlic, minced 1/2 teaspoon ground cinnamon 1/2 teaspoon ground nutmeg 1/2 teaspoon dried oregano 2 bay leaf 3 1/2 pounds boneless leg of lamb, trimmed of fat, and cut into thin strips 2 tablespoons olive oil 8 (8 inch) pita bread rounds 2 tomatoes, thinly sliced 1 onion, thinly sliced",Easy Lamb Shawarma,https://www.allrecipes.com/recipe/68828/easy-lamb-shawarma/,vinegar oil juice clove bay leaf lamb oil bread onion
Middle_eastern,"Marinade: 2 large onions, chopped 2 garlic cloves, crushed 1/2 cup olive oil 2 tablespoons lemon juice 1 teaspoon dried oregano 1 teaspoon ground black pepper 1/2 teaspoon ground turmeric 1 pinch curry powder 1 teaspoon salt 1 pound beef flank steak, thinly sliced Tzatziki Sauce: 8 ounces sour cream 2 tablespoons olive oil 1 tablespoon lemon juice 1/2 teaspoon salt 1/2 teaspoon ground black pepper 1 tablespoon chopped fresh dill 1 clove garlic, crushed",Turkish Kebabs,https://www.allrecipes.com/recipe/218488/turkish-kebabs/,marinade onion clove oil juice pepper beef steak sauce cream oil lemon juice pepper dill clove garlic
Middle_eastern,"1 head garlic, minced 1 tablespoon sea salt 1/2 cup fresh lemon juice 1 cup vegetable oil",Thick Style Lebanese Garlic Sauce,https://www.allrecipes.com/recipe/150654/thick-style-lebanese-garlic-sauce/,garlic sea lemon juice oil
Middle_eastern,"2 1/2 cups all-purpose flour 1 teaspoon white sugar 1 teaspoon salt 2/3 cup water 1 egg white 2 tablespoons butter, melted 2 egg whites, beaten",Lavosh,https://www.allrecipes.com/recipe/22394/lavosh/,sugar egg butter egg
Middle_eastern,"1 (17.25 ounce) package frozen puff pastry, thawed 5 cups milk 1 cup white sugar 1 teaspoon vanilla extract 1/4 cup raisins 1/4 cup slivered almonds 1/4 cup pine nuts 1/4 cup chopped pistachio nuts",Umm Ali,https://www.allrecipes.com/recipe/73059/umm-ali/,puff sugar vanilla raisin almond nut pistachio nut
Middle_eastern,"2 cups canned garbanzo beans, drained 1/3 cup tahini 1/4 cup lemon juice 1 teaspoon salt 2 cloves garlic, halved 1 tablespoon olive oil 1 pinch paprika",Hummus Iii,https://www.allrecipes.com/recipe/14830/hummus-iii/,bean tahini lemon juice clove oil paprika
Middle_eastern,"For Sauce: 1 (6 ounce) container plain yogurt 1/2 cucumber - peeled, seeded, and finely chopped 1 teaspoon dried dill weed salt and pepper to taste 1 tablespoon mayonnaise (optional) For Falafel: 1 (15 ounce) can chickpeas (garbanzo beans), drained 1 onion, chopped 1/2 cup fresh parsley 2 cloves garlic, chopped 1 egg 2 teaspoons ground cumin 1 teaspoon ground coriander 1 teaspoon salt 1 dash pepper 1 pinch cayenne pepper 1 teaspoon lemon juice 1 teaspoon baking powder 1 tablespoon olive oil 1 cup dry bread crumbs oil for frying 2 pita breads, cut in half (optional)",Seans Falafel And Cucumber Sauce,https://www.allrecipes.com/recipe/25309/seans-falafel-and-cucumber-sauce/,sauce weed salt pepper mayonnaise bean onion parsley clove egg coriander pepper cayenne lemon juice oil bread crumb oil bread
Middle_eastern,1 1/8 cups warm water (110 degrees F/45 degrees C) 3 cups all-purpose flour 1 teaspoon salt 1 tablespoon vegetable oil 1 1/2 teaspoons white sugar,Peppys Pita Bread,https://www.allrecipes.com/recipe/6821/peppys-pita-bread/,oil sugar
Middle_eastern,"6 tablespoons olive oil 1 large white onion, sliced into rings 1 1/3 cups uncooked green lentils 3/4 cup uncooked long-grain white rice salt and pepper to taste",Lentils And Rice With Fried Onions Mujadarrah,https://www.allrecipes.com/recipe/49353/lentils-and-rice-with-fried-onions-mujadarrah/,oil onion lentil rice salt pepper
Middle_eastern,"1/4 cup butter 2 ounces uncooked spaghetti, broken 1/4 cup minced onion 1/2 teaspoon minced garlic 1 1/4 cups uncooked jasmine rice 2 1/4 cups vegetable broth salt and pepper to taste 1/2 pound fresh asparagus, trimmed and cut into 2 inch pieces",Asparagus Cashew Rice Pilaf,https://www.allrecipes.com/recipe/29940/asparagus-cashew-rice-pilaf/,butter spaghetti onion jasmine rice salt pepper asparagus
Middle_eastern,"1 (15 ounce) can garbanzo beans, drained, liquid reserved 1 clove garlic, crushed 2 teaspoons ground cumin 1/2 teaspoon salt",Extra Easy Hummus,https://www.allrecipes.com/recipe/20797/extra-easy-hummus/,bean clove garlic salt
Middle_eastern,12 pita bread pockets 1/2 cup olive oil 1/2 teaspoon ground black pepper 1 teaspoon garlic salt 1/2 teaspoon dried basil,Pita Chips,https://www.allrecipes.com/recipe/14827/pita-chips/,oil pepper salt basil
Middle_eastern,"1 tablespoon olive oil 1 clove garlic, minced 1 cup uncooked basmati rice 2 teaspoons ground cumin 2 teaspoons ground coriander 1 teaspoon ground turmeric 1 teaspoon ground cayenne pepper 1 quart chicken stock 1 1/2 pounds ground turkey 2 (15 ounce) cans garbanzo beans (chickpeas), drained and rinsed 2 (15 ounce) cans black beans, drained and rinsed 1 bunch chopped fresh cilantro (optional) 1 bunch chopped fresh parsley (optional) 1/4 cup pine nuts (optional) salt to taste",Middle Eastern Rice With Black Beans And Chickpeas,https://www.allrecipes.com/recipe/87496/middle-eastern-rice-with-black-beans-and-chickpeas/,oil clove garlic basmati rice chicken stock bean chickpea bean cilantro parsley pine nut salt
Middle_eastern,"1 eggplant 1/4 cup lemon juice 1/4 cup tahini 2 tablespoons sesame seeds 2 cloves garlic, minced salt and pepper to taste",Baba Ghanoush,https://www.allrecipes.com/recipe/14859/baba-ghanoush/,lemon juice tahini seed clove salt pepper
Middle_eastern,"4 cloves garlic, minced 1 teaspoon kosher salt 1 pound ground lamb 3 tablespoons grated onion 3 tablespoons chopped fresh parsley 1 tablespoon ground coriander 1 teaspoon ground cumin 1/2 tablespoon ground cinnamon 1/2 teaspoon ground allspice 1/4 teaspoon cayenne pepper 1/4 teaspoon ground ginger 1/4 teaspoon ground black pepper",Kofta Kebabs,https://www.allrecipes.com/recipe/106030/kofta-kebabs/,clove kosher onion parsley coriander cayenne pepper
Middle_eastern,"1 (15 ounce) can garbanzo beans, drained, liquid reserved 2 ounces fresh jalapeno pepper, sliced 1/2 teaspoon ground cumin 2 tablespoons lemon juice",Easy Hummus,https://www.allrecipes.com/recipe/20730/easy-hummus/,bean pepper juice
Middle_eastern,"1 cup couscous 1 cup boiling water 3 tablespoons olive oil 1 clove garlic, minced 1/4 cup diced red bell pepper 4 green onions, sliced 1 cup cherry tomatoes 1 cup fresh basil leaves 1 pinch salt 1 pinch ground black pepper 1 dash balsamic vinegar",Company Couscous,https://www.allrecipes.com/recipe/18897/company-couscous/,oil clove garlic onion cherry basil pepper vinegar
Middle_eastern,"1 pound chopped nuts 1 teaspoon ground cinnamon 1 (16 ounce) package phyllo dough 1 cup butter, melted 1 cup white sugar 1 cup water 1/2 cup honey 1 teaspoon vanilla extract",Easy Baklava,https://www.allrecipes.com/recipe/20287/easy-baklava/,nut butter sugar honey vanilla
Middle_eastern,"8 cut up chicken pieces 8 medium potatoes, peeled and quartered salt to taste ground white pepper to taste 4 cloves garlic, crushed 1/2 cup extra virgin olive oil",Lebanese Chicken And Potatoes,https://www.allrecipes.com/recipe/89833/lebanese-chicken-and-potatoes/,potatoe salt pepper clove oil
Middle_eastern,"1/4 cup lemon juice 1/4 cup vegetable oil 3/4 cup plain yogurt 4 cloves garlic, minced 2 teaspoons tomato paste 1 1/2 teaspoons salt 1 teaspoon dried oregano 1/4 teaspoon ground black pepper 1/4 teaspoon ground allspice 1/4 teaspoon ground cinnamon 1/8 teaspoon ground cardamom 2 pounds skinless, boneless chicken breast halves - cut into 2 inch pieces 2 onions, cut into large chunks 1 large green bell pepper, cut into large chunks",Shish Tawook Grilled Chicken,https://www.allrecipes.com/recipe/150251/shish-tawook-grilled-chicken/,lemon juice oil clove pepper chicken breast onion chunk pepper chunk
Middle_eastern,"1 (16 ounce) package frozen cut green beans 1/4 cup extra virgin olive oil salt to taste 1 clove garlic, minced",Fasoliyyeh Bi Z Zayt Syrian Green Beans With Olive Oil,https://www.allrecipes.com/recipe/56161/fasoliyyeh-bi-z-zayt-syrian-green-beans-with-olive-oil/,bean oil salt clove garlic
Middle_eastern,"1 cup bulgur 3 tomatoes, seeded and chopped 2 cucumbers, peeled and chopped 3 green onions, chopped 3 cloves garlic, minced 1 cup chopped fresh parsley 1/3 cup fresh mint leaves 2 teaspoons salt 1/2 cup lemon juice",Tabbouleh Iii,https://www.allrecipes.com/recipe/14438/tabbouleh-iii/,bulgur cucumber onion clove parsley mint lemon juice
Middle_eastern,"3 tablespoons vegetable oil 2 tablespoons plain low-fat yogurt 2 tablespoons ketchup 2 tablespoons prepared mustard 1 1/2 teaspoons garlic powder 2 teaspoons paprika 1 1/2 teaspoons ground allspice 1/2 teaspoon black pepper 1/4 teaspoon ground cinnamon 1/4 teaspoon curry powder (optional) 3 pounds skinless, boneless chicken breast halves - cut into bite-size pieces Dipping Sauce: 1/2 cup mayonnaise 1 cup plain low-fat yogurt 3 cloves garlic, minced",Shish Tawook Marinated Chicken,https://www.allrecipes.com/recipe/84124/shish-tawook-marinated-chicken/,oil yogurt pepper chicken breast sauce mayonnaise yogurt clove
Middle_eastern,"1 tablespoon olive oil 1 large onion, chopped 1 tablespoon salt 1 cup dry red lentils, rinsed and drained 6 cups water 2 tablespoons olive oil 1 bunch collard greens - rinsed, stemmed and thinly sliced 1 tablespoon ground cumin 1 teaspoon ground cinnamon 2 tablespoons minced garlic",Lentil And Green Collard Soup,https://www.allrecipes.com/recipe/137450/lentil-and-green-collard-soup/,oil onion lentil oil collard
Middle_eastern,"3 tablespoons olive oil 1 1/3 cups chopped onion 1 cup thinly sliced bell peppers, any color 2 cloves garlic, minced, or to taste 2 1/2 cups chopped tomatoes 1 teaspoon ground cumin 1 teaspoon paprika 1 teaspoon salt 1 hot chile pepper, seeded and finely chopped, or to taste",Chakchouka Shakshouka,https://www.allrecipes.com/recipe/213717/chakchouka-shakshouka/,oil onion pepper color clove chili pepper
Middle_eastern,"1 teaspoon olive oil 1 cup sliced onion 2 1/2 pounds skinless, boneless chicken thighs 1 tablespoon garam masala 1/2 teaspoon curry powder 1/2 cup red wine 2 tablespoons red wine vinegar",Mid Eastern Chicken Thighs,https://www.allrecipes.com/recipe/214021/mid-eastern-chicken-thighs/,oil onion chicken garam wine wine vinegar
Middle_eastern,"1 1/2 cups couscous 3 cups chicken stock 1 tablespoon curry powder 2 teaspoons salt 1 teaspoon ground black pepper 2 tablespoons extra-virgin olive oil 1/2 cup raisins 1 bunch cilantro, chopped",Easy Curry Couscous,https://www.allrecipes.com/recipe/140319/easy-curry-couscous/,stock pepper oil raisin cilantro
Middle_eastern,"1 1/2 pounds lean ground beef 1 medium onion, grated 1/2 cup finely chopped fresh parsley 1/4 teaspoon cayenne pepper 1/4 teaspoon ground allspice 1 teaspoon salt, or to taste 1/4 teaspoon black pepper",Kafta,https://www.allrecipes.com/recipe/64519/kafta/,beef onion parsley cayenne salt pepper
Middle_eastern,"2 pita breads 8 leaves romaine lettuce, torn into bite-size pieces 2 green onions, chopped 1 cucumber, chopped 3 tomatoes, cut into wedges 1/4 cup chopped fresh parsley 1 clove garlic, peeled and chopped 2 tablespoons sumac powder 1/4 cup lemon juice 1/4 cup olive oil 1 teaspoon salt 1/4 teaspoon ground black pepper",Fatoosh,https://www.allrecipes.com/recipe/24808/fatoosh/,bread lettuce onion cucumber parsley clove garlic lemon juice oil pepper
Middle_eastern,1 1/8 cups water 2 tablespoons vegetable oil 1/2 teaspoon white sugar 1 1/2 teaspoons salt 3 cups all-purpose flour,Syrian Bread,https://www.allrecipes.com/recipe/20834/syrian-bread/,oil sugar flour
Middle_eastern,"4 cloves garlic 1 teaspoon salt 3 tablespoons tahini paste 1/4 cup fresh lemon juice 2 (15.5 ounce) cans garbanzo beans, drained 1/2 cup olive oil 1/2 cup oil-packed sun-dried tomatoes, drained 1/4 cup finely shredded fresh basil 2 tablespoons olive oil",Sun Dried Tomato Hummus,https://www.allrecipes.com/recipe/141399/sun-dried-tomato-hummus/,clove lemon juice bean oil basil oil
Middle_eastern,"5 unpeeled garlic cloves 1 tablespoon extra-virgin olive oil 1 (15 ounce) can garbanzo beans, drained 1/2 cup tahini 1/3 cup fresh lemon juice 1 teaspoon ground cumin 1 teaspoon salt",Authentic Kicked Up Syrian Hummus,https://www.allrecipes.com/recipe/126786/authentic-kicked-up-syrian-hummus/,clove oil bean tahini lemon juice salt
Middle_eastern,"6 cucumbers, diced 4 roma (plum) tomatoes, seeded and diced 5 green onions, sliced 1 red bell pepper, seeded and diced 1/3 cup chopped garlic 1 cup chopped fresh parsley 1/2 cup minced fresh mint leaves 1/2 cup olive oil 2 tablespoons fresh lemon juice 1 tablespoon salt",Israeli Salad,https://www.allrecipes.com/recipe/208878/israeli-salad/,cucumber tomato plum onion pepper parsley mint oil juice salt
Middle_eastern,"1 cup dry lentils, rinsed 2 cups water 1 teaspoon salt 1 tablespoon ground cumin 1 tablespoon garlic powder 3/4 cup white rice, rinsed 3/4 cup water 1 teaspoon salt 2 tablespoons olive oil 1/4 cup vegetable oil",Mujaddara Arabic Lentil Rice,https://www.allrecipes.com/recipe/214780/mujaddara-arabic-lentil-rice/,lentil rice oil oil
Middle_eastern,"1 head garlic, minced 1 tablespoon sea salt 1/2 cup fresh lemon juice 1 cup vegetable oil",Thick Style Lebanese Garlic Sauce,https://www.allrecipes.com/recipe/150654/thick-style-lebanese-garlic-sauce/,garlic sea lemon juice oil
Middle_eastern,"2 (15 ounce) cans garbanzo beans, drained and rinsed 2 (15 ounce) cans black beans, drained and rinsed 1/2 cup (packed) chopped fresh mint 1/2 cup (packed) chopped fresh parsley 1/2 cup chopped onion 1 pint grape tomatoes, halved 1 jalapeno pepper, finely chopped 1 clove garlic, minced 1/4 cup olive oil 3 tablespoons lemon juice 5 tablespoons apple cider vinegar",Balela Salad,https://www.allrecipes.com/recipe/218648/balela-salad/,bean bean mint parsley onion grape jalapeno pepper clove garlic oil juice apple cider vinegar
Middle_eastern,"1 cup bulgur 1 2/3 cups boiling water 1/3 cup olive oil 1/3 cup lemon juice 1 cup chopped green onions 1 cup chopped fresh parsley 1/4 cup chopped fresh mint 3 tomatoes, chopped 1 cucumber - peeled, seeded and chopped 1 teaspoon salt",Tabbouleh I,https://www.allrecipes.com/recipe/14229/tabbouleh-i/,oil lemon juice onion parsley mint salt
Middle_eastern,1 cup warm water 1 (.25 ounce) package active dry yeast 1 tablespoon molasses 1 teaspoon salt 1 1/2 cups whole wheat flour 1 1/2 cups soy flour cooking spray,Whole Wheat Pita Bread,https://www.allrecipes.com/recipe/70006/whole-wheat-pita-bread/,yeas molasse wheat
Middle_eastern,"1 pound skinless, boneless chicken breast halves - cut into 2 inch pieces 4 cloves garlic, chopped 1 large onion, chopped 1 (28 ounce) can diced tomatoes 3 fresh peaches - peeled, pitted, and sliced 1 (15 ounce) can garbanzo beans, drained 1 cup chopped dried apricots 2 teaspoons ground cumin 1 teaspoon ground ginger 1 teaspoon cinnamon 1/2 teaspoon ground coriander 1/2 teaspoon cayenne pepper 2 cups chicken broth 1 tablespoon cornstarch 1 tablespoon water 3 tablespoons chopped fresh cilantro",Slow Cooker Moroccan Chicken,https://www.allrecipes.com/recipe/215218/slow-cooker-moroccan-chicken/,boneless chicken breast clove onion peache bean apricot cinnamon coriander cayenne cornstarch cilantro
Middle_eastern,"1/2 cup fresh lemon juice 1/2 cup mild extra-virgin olive oil 3 cloves garlic, minced 1 teaspoon kosher salt",Lebanese Lemon Salad Dressing,https://www.allrecipes.com/recipe/164512/lebanese-lemon-salad-dressing/,lemon juice oil clove kosher salt
Middle_eastern,"2 sprigs fresh rosemary 1 clove garlic, peeled 2 (15.5 ounce) cans garbanzo beans, drained 1/4 cup olive oil 1/4 cup balsamic vinegar 1/4 cup cold water",Fusion Hummus,https://www.allrecipes.com/recipe/137535/fusion-hummus/,sprig clove garlic bean oil vinegar
Middle_eastern,"3 1/2 pounds lamb ribs 2 onions, chopped 1 cup dry white wine 1/4 cup soy sauce 1/4 cup fresh lemon juice 1 tablespoon honey 1 tablespoon olive oil 2 teaspoons minced garlic 1 teaspoon ground cinnamon 1 teaspoon salt",Lamb Ribs With Honey And Wine,https://www.allrecipes.com/recipe/25885/lamb-ribs-with-honey-and-wine/,onion wine lemon juice honey oil salt
Middle_eastern,"1/4 cup bulgur 1/2 cup boiling water 1 cup chopped parsley 1/4 cup chopped fresh mint leaves 5 tomatoes, diced 1 onion, finely diced 2 teaspoons olive oil 1 lemon, juiced",Tabbouleh Ii,https://www.allrecipes.com/recipe/16135/tabbouleh-ii/,bulgur mint onion oil lemon
Middle_eastern,"3 cups dry garbanzo beans, soaked overnight 1 pinch baking soda (optional) 1/2 cup extra-virgin olive oil 3/4 cup tahini paste 1/4 cup fresh lemon juice, or more to taste 1 large clove garlic, minced, or more to taste 1 teaspoon ground cumin salt to taste",Authentic Middle Eastern Hummus Chummus,https://www.allrecipes.com/recipe/161082/authentic-middle-eastern-hummus-chummus/,garbanzo bean soda oil tahini lemon juice clove garlic cumin salt
Middle_eastern,"1/2 cup tahini (sesame paste) 1/2 cup olive oil 1/2 cup water 1/4 cup tamari (dark soy sauce) 2 tablespoons red wine vinegar 2 tablespoons lemon juice 2 teaspoons minced fresh ginger root 2 cloves garlic, pressed",Tasteful Tahini Salad Dressing,https://www.allrecipes.com/recipe/215069/tasteful-tahini-salad-dressing/,tahini oil tamari sauce wine vinegar juice ginger root clove
Middle_eastern,"1 cup dry garbanzo beans 1/2 yellow onion, diced 1/2 cup chopped fresh flat-leaf parsley 4 cloves minced garlic 1 tablespoon all-purpose flour, or more as needed 2 teaspoons lemon juice 1 1/2 teaspoons salt, or to taste 1 teaspoon ground cumin 1/2 teaspoon ground coriander 1/4 teaspoon baking soda 1/8 teaspoon cayenne pepper",Chef Johns Falafel,https://www.allrecipes.com/recipe/241705/chef-johns-falafel/,garbanzo bean onion parsley clove flour juice salt coriander soda cayenne pepper
Middle_eastern,"1 (15 ounce) can fava beans 1 1/2 tablespoons olive oil 1 large onion, chopped 1 large tomato, diced 1 teaspoon ground cumin 1/4 cup chopped fresh parsley 1/4 cup fresh lemon juice salt and pepper to taste",Fava Bean Breakfast Spread,https://www.allrecipes.com/recipe/17596/fava-bean-breakfast-spread/,bean oil onion tomato parsley lemon juice salt pepper
Middle_eastern,"2 tablespoons olive oil 1 1/2 pounds chicken legs, cut up 1 white onion, thinly sliced 1/2 pound walnuts, toasted and finely ground in a food processor 1 teaspoon salt 4 cups pomegranate juice 1/2 teaspoon cardamom (optional)",Pomegranate Stew With Chicken Khoresh Fesenjan,https://www.allrecipes.com/recipe/85118/pomegranate-stew-with-chicken-khoresh-fesenjan/,oil onion walnut juice cardamom
Middle_eastern,"1 1/2 cups dry garbanzo beans 2 tablespoons tahini 1 teaspoon sea salt 2 lemons, juiced 4 cloves garlic, crushed or to taste 1 cup filtered or spring water",Raw Hummus,https://www.allrecipes.com/recipe/72926/raw-hummus/,garbanzo bean sea lemon clove spring
Middle_eastern,1 teaspoon ground cumin 1 teaspoon ground coriander seed 1 teaspoon ground ginger 1 teaspoon ground cinnamon 1 teaspoon fresh ground black pepper 1/4 teaspoon kosher salt,Middle Eastern Turkey Dogs,https://www.allrecipes.com/recipe/83104/middle-eastern-turkey-dogs/,seed pepper kosher salt
Middle_eastern,"1 tablespoon vegetable oil 2 green onions, chopped 3/4 cup diced fresh mushrooms 3 cloves garlic, chopped 1 (15.5 ounce) can garbanzo beans, with liquid 1 1/2 tablespoons chopped fresh cilantro 1 1/2 teaspoons minced fresh parsley 1 1/2 tablespoons curry powder 1/2 teaspoon ground cumin 1/2 cup dry bread crumbs 2 egg whites",Chickpea Falafel Burgers,https://www.allrecipes.com/recipe/49374/chickpea-falafel-burgers/,oil onion mushroom clove bean cilantro parsley bread egg
