class,ingredients_string,name,url,ingredients_proper
French,"6 bone-in, skin-on chicken thighs 1 pinch kosher salt and freshly ground black pepper to taste 8 ounces bacon, sliced crosswise into 1/2-inch pieces 10 large button mushrooms, quartered 1/2 large yellow onion, diced 2 shallots, sliced 2 teaspoons all-purpose flour 2 teaspoons butter 1 1/2 cups red wine 6 sprigs fresh thyme",Chef Johns Coq Au Vin,https://www.allrecipes.com/recipe/239230/chef-johns-coq-au-vin/,chicken kosher salt pepper bacon crosswise mushroom onion shallot wine sprig thyme
French,"6 skinless, boneless chicken breast halves 6 slices Swiss cheese 6 slices ham 3 tablespoons all-purpose flour 1 teaspoon paprika 6 tablespoons butter 1/2 cup dry white wine 1 teaspoon chicken bouillon granules 1 tablespoon cornstarch",Chicken Cordon Bleu Ii,https://www.allrecipes.com/recipe/8669/chicken-cordon-bleu-ii/,boneless chicken breast wine chicken cornstarch
French,"4 russet potatoes, sliced into 1/4 inch slices 1 onion, sliced into rings salt and pepper to taste 3 tablespoons butter 3 tablespoons all-purpose flour 1/2 teaspoon salt 2 cups milk",Creamy Au Gratin Potatoes,https://www.allrecipes.com/recipe/15925/creamy-au-gratin-potatoes/,russet potatoe onion salt pepper milk
French,1 cup all-purpose flour 2 eggs 1/2 cup milk 1/2 cup water 1/4 teaspoon salt,Basic Crepes,https://www.allrecipes.com/recipe/16383/basic-crepes/,flour egg milk salt
French,"4 skinless, boneless chicken breast halves 1/4 teaspoon salt 1/8 teaspoon ground black pepper 6 slices Swiss cheese 4 slices cooked ham",Chicken Cordon Bleu I,https://www.allrecipes.com/recipe/8495/chicken-cordon-bleu-i/,boneless chicken breast pepper ham
French,1 cup water 2 1/2 cups bread flour 1 tablespoon white sugar 1 teaspoon salt 1 1/2 teaspoons bread machine yeast 1 egg yolk,French Baguettes,https://www.allrecipes.com/recipe/7028/french-baguettes/,sugar machine yeas egg yolk
French,"4 tablespoons butter 1 teaspoon salt 2 large red onions, thinly sliced 2 large sweet onions, thinly sliced 1 (48 fluid ounce) can chicken broth 1 (14 ounce) can beef broth 1/2 cup red wine 1 tablespoon Worcestershire sauce 2 sprigs fresh parsley 1 sprig fresh thyme leaves 1 bay leaf 1 tablespoon balsamic vinegar salt and freshly ground black pepper to taste 4 thick slices French or Italian bread 8 slices Gruyere or Swiss cheese slices, room temperature 1/2 cup shredded Asiago or mozzarella cheese, room temperature",French Onion Soup Gratinee,https://www.allrecipes.com/recipe/91192/french-onion-soup-gratinee/,onion onion fluid wine worcestershire sprig parsley sprig thyme bay leaf vinegar salt pepper bread cheese room room
French,6 cups all-purpose flour 2 1/2 (.25 ounce) packages active dry yeast 1 1/2 teaspoons salt 2 cups warm water (110 degrees F/45 degrees C) 1 tablespoon cornmeal 1 egg white,French Bread,https://www.allrecipes.com/recipe/6882/french-bread/,yeas cornmeal egg
French,"1/2 cup unsalted butter 2 tablespoons olive oil 4 cups sliced onions 4 (10.5 ounce) cans beef broth 2 tablespoons dry sherry (optional) 1 teaspoon dried thyme salt and pepper to taste 4 slices French bread 4 slices provolone cheese 2 slices Swiss cheese, diced",Rich And Simple French Onion Soup,https://www.allrecipes.com/recipe/13309/rich-and-simple-french-onion-soup/,oil onion sherry salt pepper cheese
French,"9 ounces bittersweet chocolate, chopped 1 cup heavy cream",Chocolate Ganache,https://www.allrecipes.com/recipe/33647/chocolate-ganache/,chocolate cream
French,2 eggs 1 cup milk 2/3 cup all-purpose flour 1 pinch salt,Crepes,https://www.allrecipes.com/recipe/27188/crepes/,egg milk flour salt
French,"2 tablespoons olive oil 3 cloves garlic, minced 2 teaspoons dried parsley 1 eggplant, cut into 1/2 inch cubes salt to taste 1 cup grated Parmesan cheese 2 zucchini, sliced 1 large onion, sliced into rings 2 cups sliced fresh mushrooms 1 green bell pepper, sliced",Ratatouille,https://www.allrecipes.com/recipe/18411/ratatouille/,oil clove eggplant salt zucchini onion mushroom pepper
French,"4 eggs, lightly beaten 1 1/3 cups milk 2 tablespoons butter, melted 1 cup all-purpose flour 2 tablespoons white sugar",Dessert Crepes,https://www.allrecipes.com/recipe/19037/dessert-crepes/,egg butter flour sugar
French,3 egg yolks 1/4 teaspoon Dijon mustard 1 tablespoon lemon juice 1 dash hot pepper sauce (e.g. Tabasco(TM)),Blender Hollandaise Sauce,https://www.allrecipes.com/recipe/84214/blender-hollandaise-sauce/,egg yolk dijon lemon juice pepper sauce tabasco
French,1 1/2 cups milk 3 egg yolks 2 tablespoons vanilla extract 1 1/2 cups all-purpose flour 2 tablespoons sugar 1/2 teaspoon salt,Vanilla Crepes,https://www.allrecipes.com/recipe/95817/vanilla-crepes/,milk egg yolk vanilla salt
French,3 cups all-purpose flour 1 1/2 teaspoons salt 3 tablespoons white sugar 1 cup shortening 1 egg 1 teaspoon distilled white vinegar,French Pastry Pie Crust,https://www.allrecipes.com/recipe/15075/french-pastry-pie-crust/,sugar egg vinegar
French,1 cup all-purpose flour 1 teaspoon white sugar 1/4 teaspoon salt 3 eggs 2 cups milk,French Crepes,https://www.allrecipes.com/recipe/20931/french-crepes/,flour sugar egg milk
French,"1 1/2 pounds cubed beef stew meat 1/4 cup all-purpose flour 2 tablespoons vegetable oil 2 (14.5 ounce) cans Italian-style diced tomatoes 1 (14 ounce) can beef broth 4 carrots, chopped 2 potatoes, peeled and chopped 3/4 teaspoon dried thyme 2 tablespoons Dijon-style prepared mustard",French Beef Stew,https://www.allrecipes.com/recipe/13345/french-beef-stew/,beef stew meat flour oil carrot potatoe mustard
French,"1 recipe pastry for a 9 inch single crust pie 12 slices bacon 1 cup shredded Swiss cheese 1/3 cup minced onion 4 eggs, beaten 2 cups light cream 3/4 teaspoon salt 1/4 teaspoon white sugar",Quiche Lorraine I,https://www.allrecipes.com/recipe/17515/quiche-lorraine-i/,cheese onion egg cream sugar
French,"6 egg yolks 6 tablespoons white sugar, divided 1/2 teaspoon vanilla extract 2 1/2 cups heavy cream",Creme Brulee,https://www.allrecipes.com/recipe/19165/creme-brulee/,egg yolk sugar vanilla cream
French,"8 skinless, boneless chicken breasts 8 slices cooked ham 4 slices Swiss cheese, cut into 1 inch pieces salt and pepper to taste 1 teaspoon dried thyme 1/4 cup melted butter 1/2 cup cornflakes cereal crumbs 1 (10.75 ounce) can condensed cream of chicken soup 1/2 cup sour cream",Cordon Bleu Chicken Rolls,https://www.allrecipes.com/recipe/16602/cordon-bleu-chicken-rolls/,boneless chicken cheese salt pepper crumb cream chicken cream
French,2 cups milk 1/4 cup white sugar 2 egg yolks 1 egg 1/4 cup cornstarch 1/3 cup white sugar 2 tablespoons butter,Pastry Cream,https://www.allrecipes.com/recipe/76043/pastry-cream/,sugar egg yolk egg cornstarch sugar butter
French,"6 skinless, boneless chicken breast halves 1 (10.75 ounce) can condensed cream of chicken soup 1 cup milk 4 ounces sliced ham 4 ounces sliced Swiss cheese 1 (8 ounce) package herbed dry bread stuffing mix",Slow Cooker Chicken Cordon Bleu,https://www.allrecipes.com/recipe/81124/slow-cooker-chicken-cordon-bleu/,boneless chicken breast cream chicken milk cheese bread
French,"1/4 cup butter 3 onions, thinly sliced 1 teaspoon white sugar 1 tablespoon all-purpose flour 2 1/2 cups water 1/2 cup red wine 2 (10.5 ounce) cans condensed beef broth 1 French baguette",French Onion Soup I,https://www.allrecipes.com/recipe/12926/french-onion-soup-i/,butter onion sugar flour wine beef baguette
French,1/2 cup butter 1 cup water 1 cup all-purpose flour 1/4 teaspoon salt 4 eggs 1 (5 ounce) package instant vanilla pudding mix 2 1/2 cups cold milk 1 cup heavy cream 1/4 cup confectioners' sugar 1 teaspoon vanilla extract 2 (1 ounce) squares semisweet chocolate 2 tablespoons butter 1 cup confectioners' sugar 1 teaspoon vanilla extract,Eclairs Ii,https://www.allrecipes.com/recipe/19010/eclairs-ii/,butter flour egg vanilla milk cream confectioner sugar vanilla chocolate confectioner sugar vanilla
French,"2 eggs 2 slices ham, chopped (optional) 1/2 cup shredded Cheddar cheese 1 tablespoon chopped onion (optional) 1 tablespoon chopped green bell pepper (optional) 2 tablespoons chopped fresh tomato (optional) 1 tablespoon chunky salsa (optional)",Omelet In A Bag,https://www.allrecipes.com/recipe/85107/omelet-in-a-bag/,egg ham cheddar cheese onion pepper tomato salsa
French,4 egg whites,Authentic French Meringues,https://www.allrecipes.com/recipe/58871/authentic-french-meringues/,egg
French,"1 (8 ounce) wheel Brie cheese 3 tablespoons apricot preserves 1/2 (17.5 ounce) package frozen puff pastry, thawed",Brie Cheese Appetizer,https://www.allrecipes.com/recipe/15015/brie-cheese-appetizer/,puff
French,"1 (6 ounce) can tomato paste 1/2 onion, chopped 1/4 cup minced garlic 1 tablespoon olive oil 3/4 cup water salt and ground black pepper to taste 1 small eggplant, trimmed and very thinly sliced 1 zucchini, trimmed and very thinly sliced 1 yellow squash, trimmed and very thinly sliced 1 red bell pepper, cored and very thinly sliced 1 yellow bell pepper, cored and very thinly sliced 3 tablespoons olive oil, or to taste 1 teaspoon fresh thyme leaves, or to taste",Disneys Ratatouille,https://www.allrecipes.com/recipe/222006/disneys-ratatouille/,onion oil salt pepper eggplant zucchini squash pepper pepper oil thyme
French,"50 fresh mussels, scrubbed and debearded 2 tablespoons extra virgin olive oil 5 cloves garlic, minced 1 cup white wine 2 tablespoons margarine or butter 3 green onions, chopped 1 bunch fresh parsley, chopped 3 roma (plum) tomatoes, chopped",Pattis Mussels A La Mariniere,https://www.allrecipes.com/recipe/42657/pattis-mussels-a-la-mariniere/,mussel oil clove onion parsley tomato plum
French,"2 (.25 ounce) packages active dry yeast 1/2 cup warm water (110 degrees F) 2 cups water 6 cups bread flour 1 tablespoon salt 1 tablespoon white sugar 5 tablespoons vegetable oil 2 tablespoons cornmeal 1 egg white, beaten",Fabulous French Loaves,https://www.allrecipes.com/recipe/20160/fabulous-french-loaves/,yeas sugar oil egg
French,"1 (18.25 ounce) package chocolate cake mix 1 (14 ounce) can sweetened condensed milk 2 (1 ounce) squares unsweetened chocolate, melted 1/2 cup cold water 1 (3.9 ounce) package instant chocolate pudding mix",Chocolate Mousse Cake Iv,https://www.allrecipes.com/recipe/17539/chocolate-mousse-cake-iv/,milk chocolate chocolate
French,2 cups heavy cream 1/2 cup confectioners' sugar 1/2 cup unsweetened cocoa powder 1 teaspoon vanilla extract 6 egg yolks 1/2 cup white sugar 1/3 cup unsweetened cocoa powder 1 1/2 teaspoons vanilla extract 1/8 teaspoon salt 6 egg whites 1/4 cup white sugar,Buche De Noel,https://www.allrecipes.com/recipe/17345/buche-de-noel/,cream confectioner sugar cocoa vanilla egg yolk sugar cocoa vanilla salt egg sugar
French,"2 boneless pork loin chops, butterflied 4 ounces crumbled blue cheese 2 slices bacon - cooked and crumbled 2 tablespoons chopped fresh chives garlic salt to taste ground black pepper to taste",Blue Cheese Bacon And Chive Stuffed Pork Chops,https://www.allrecipes.com/recipe/81087/blue-cheese-bacon-and-chive-stuffed-pork-chops/,boneless pork chop chive salt pepper
French,"8 skinless, boneless chicken breast halves 8 slices ham 8 slices Swiss cheese 1 (10.75 ounce) can condensed cream of chicken soup 1 cup sour cream 1/2 cup white wine 1 teaspoon garlic powder 1 teaspoon dried parsley 1 teaspoon salt 1 teaspoon ground black pepper",Different Chicken Cordon Bleu,https://www.allrecipes.com/recipe/17120/different-chicken-cordon-bleu/,boneless chicken breast cream chicken cream wine pepper
French,"6 skinless, boneless chicken breast halves - pounded to 1/2 inch thickness 6 string cheese sticks 6 slices ham 1/2 cup butter, melted 1 cup seasoned dry bread crumbs",Easy Baked Chicken Cordon Bleu,https://www.allrecipes.com/recipe/83414/easy-baked-chicken-cordon-bleu/,boneless chicken breast butter bread crumb
French,"4 onions, chopped 3 tablespoons butter 3 tablespoons all-purpose flour 1 teaspoon ground black pepper 1 teaspoon white sugar 3 (10.5 ounce) cans beef broth 1 1/4 cups water 1/2 teaspoon dried parsley 1/4 teaspoon dried thyme 1 cup white wine 1 French baguette, cut into 1/2 inch slices",French Onion Soup V,https://www.allrecipes.com/recipe/16386/french-onion-soup-v/,onion pepper sugar wine baguette
French,"1/2 cup all-purpose flour 4 eggs, beaten 1 pound skinless, boneless chicken breast halves 1/2 cup white wine 2 cups chicken broth 1 teaspoon chopped fresh parsley salt and pepper to taste 1/4 cup butter 2 lemons, juiced",Delicious Easy Chicken Francese,https://www.allrecipes.com/recipe/16681/delicious-easy-chicken-francese/,flour egg boneless chicken breast wine parsley salt pepper butter lemon
French,3 cups all-purpose flour 1 teaspoon active dry yeast 2 teaspoons salt 1 2/3 cups warm water (110 degrees F/45 degrees C) 1 teaspoon chopped fresh rosemary (optional) 1 teaspoon chopped fresh thyme (optional),No Knead Artisan Style Bread,https://www.allrecipes.com/recipe/214751/no-knead-artisan-style-bread/,yeas rosemary thyme
French,3 egg whites 1/4 cup white sugar 1 2/3 cups confectioners' sugar,Macaron French Macaroon,https://www.allrecipes.com/recipe/223234/macaron-french-macaroon/,egg confectioner sugar
French,2 cups heavy cream 1/4 cup white sugar 1 pinch salt 1 teaspoon vanilla extract 3 egg yolks,Creme Brulee Ii,https://www.allrecipes.com/recipe/19029/creme-brulee-ii/,cream sugar vanilla egg yolk
French,2 eggs 3/4 teaspoon vanilla extract 1/8 teaspoon salt 1/3 cup white sugar 1/2 cup all-purpose flour 1 tablespoon lemon zest 1/4 cup butter,French Butter Cakes Madeleines,https://www.allrecipes.com/recipe/9954/french-butter-cakes-madeleines/,egg vanilla sugar flour lemon butter
French,"1 cup chopped dried figs 1/2 cup water 1 tablespoon olive oil 2 tablespoons balsamic vinegar 1 teaspoon dried rosemary 1 teaspoon dried thyme 1/4 teaspoon cayenne pepper 2/3 cup chopped kalamata olives 2 cloves garlic, minced salt and pepper to taste 1/3 cup chopped toasted walnuts",Fig And Olive Tapenade,https://www.allrecipes.com/recipe/50843/fig-and-olive-tapenade/,figs oil vinegar cayenne olive clove salt pepper walnut
French,"3 pounds Yukon Gold potatoes, peeled and very thinly sliced 3 cloves garlic, minced 3/4 teaspoon salt 1 cup heavy cream, divided freshly ground black pepper to taste freshly grated nutmeg to taste",Rich And Creamy Potatoes Au Gratin,https://www.allrecipes.com/recipe/219721/rich-and-creamy-potatoes-au-gratin/,potatoe clove cream pepper nutmeg
French,"2 onions, thinly sliced 1/4 cup butter 2 tablespoons all-purpose flour 2 (10.5 ounce) cans beef broth 2 1/2 cups water 6 slices French bread, toasted 1/2 cup grated Parmesan cheese",French Onion Soup Iii,https://www.allrecipes.com/recipe/13395/french-onion-soup-iii/,onion butter bread cheese
French,1 1/2 cups all-purpose flour 1 1/2 teaspoons baking powder 1/2 teaspoon salt 1/4 teaspoon nutmeg 1/2 cup white sugar 1/3 cup shortening 1 egg 1/2 cup milk 1/2 cup white sugar 1 teaspoon ground cinnamon,French Breakfast Puffs,https://www.allrecipes.com/recipe/24149/french-breakfast-puffs/,sugar egg milk sugar cinnamon
French,"1/2 (17.5 ounce) package frozen puff pastry, thawed 1 (8 ounce) wheel Brie cheese",Baked Brie In Puff Pastry,https://www.allrecipes.com/recipe/15192/baked-brie-in-puff-pastry/,puff cheese
French,"1 recipe pastry for a 9 inch single crust pie 6 slices bacon 1 onion, sliced 3 eggs, beaten 1 1/2 cups milk 1/4 teaspoon salt 1 1/2 cups shredded Swiss cheese",Quiche Lorraine Ii,https://www.allrecipes.com/recipe/18477/quiche-lorraine-ii/,onion egg cheese
French,"1/4 cup all-purpose flour 1/2 teaspoon salt 1/4 teaspoon pepper 1 teaspoon chopped fresh parsley 1/2 teaspoon dried dill weed 1/4 cup butter, divided 4 boneless, skinless chicken breast halves 1 pound fresh mushrooms 1 onion, sliced into rings 1/2 cup white wine",Chicken Gruyere With Sauteed Mushrooms,https://www.allrecipes.com/recipe/28078/chicken-gruyere-with-sauteed-mushrooms/,flour pepper parsley butter boneless chicken breast mushroom onion wine
French,"1 egg 1/2 cup milk 2 pounds skinless, boneless chicken breast halves - cut into chunks 1 cup plain dried bread crumbs 1 cup oil for frying 8 ounces Swiss cheese, cubed 8 ounces cubed ham 1 (10.75 ounce) can condensed cream of chicken soup",Chicken Cordon Bleu Casserole,https://www.allrecipes.com/recipe/132959/chicken-cordon-bleu-casserole/,egg milk chicken breast chunk crumb oil cheese cream chicken
French,"3 cups Burgundy wine 2 tablespoons brandy 2 onions, thinly sliced 2 carrots, chopped 1 sprig fresh parsley 1 bay leaf 1 clove garlic, crushed 10 whole black peppercorns 1 teaspoon salt 2 pounds cubed beef chuck roast 4 tablespoons olive oil, divided 1/4 pound bacon, cubed 2 onions, chopped 3 tablespoons all-purpose flour 1 tablespoon tomato paste 2 cloves garlic, crushed 1 (10.5 ounce) can beef broth salt and pepper to taste 4 tablespoons butter",Beef Bourguignon I,https://www.allrecipes.com/recipe/16167/beef-bourguignon-i/,onion carrot sprig parsley bay leaf clove garlic beef oil bacon onion tomato clove salt pepper butter
French,"1 tablespoon active dry yeast 2 tablespoons white sugar 1 teaspoon salt 3 1/2 cups all-purpose flour 1 cup milk 1 tablespoon distilled white vinegar 1/4 cup water 1/4 cup margarine 1/2 cup minced onion 1 clove garlic, minced 1/2 teaspoon salt 1 tablespoon minced parsley",French Herb Bread,https://www.allrecipes.com/recipe/7065/french-herb-bread/,yeas sugar milk vinegar margarine onion clove garlic parsley
French,"3 cloves garlic, peeled 1 cup pitted kalamata olives 2 tablespoons capers 3 tablespoons chopped fresh parsley 2 tablespoons lemon juice 2 tablespoons olive oil",Kalamata Olive Tapenade,https://www.allrecipes.com/recipe/165309/kalamata-olive-tapenade/,clove kalamata caper parsley juice oil
French,2 cups heavy cream 1/3 cup white sugar 6 egg yolks 1 teaspoon vanilla extract 3 tablespoons Irish cream liqueur,Irish Cream Creme Brulee,https://www.allrecipes.com/recipe/138086/irish-cream-creme-brulee/,cream sugar egg yolk vanilla cream liqueur
French,"5 onions, thinly sliced 6 cups beef broth 2 tablespoons vegetable oil 3 tablespoons butter or margarine 1 pound shredded Swiss cheese 1 teaspoon white sugar 1/2 cup white wine salt and pepper to taste",Lances French Onion Soup,https://www.allrecipes.com/recipe/13308/lances-french-onion-soup/,onion oil butter cheese sugar wine salt pepper
French,2 eggs 1/2 teaspoon vanilla extract 1/2 teaspoon lemon zest 1 cup confectioners' sugar 3/4 cup all-purpose flour 1/4 teaspoon baking powder,Madeleines Ii,https://www.allrecipes.com/recipe/11350/madeleines-ii/,egg vanilla lemon confectioner sugar flour
French,"1 (9 inch) refrigerated pie crust 2 teaspoons butter 3 leeks, chopped 1 pinch salt and black pepper to taste 1 cup light cream",French Leek Pie,https://www.allrecipes.com/recipe/81537/french-leek-pie/,leek salt pepper cream
French,3/4 cup water 2 teaspoons honey 2 teaspoons olive oil 2/3 teaspoon salt 2/3 teaspoon white sugar 2 cups bread flour 1 1/2 teaspoons active dry yeast,Sweet Honey French Bread,https://www.allrecipes.com/recipe/6818/sweet-honey-french-bread/,oil sugar yeas
French,"6 tablespoons white sugar, divided 14 Italian prune plums, halved and pitted 3 eggs 1 1/3 cups milk 2/3 cup all-purpose flour 1 1/2 teaspoons grated lemon zest 2 teaspoons vanilla 1 pinch salt 1/2 teaspoon ground cinnamon",Plum Clafouti,https://www.allrecipes.com/recipe/41234/plum-clafouti/,sugar prune plum egg flour cinnamon
French,1/2 cup egg whites 1/4 teaspoon cream of tartar 1/4 teaspoon salt 1 teaspoon vanilla extract 1 cup white sugar 1 tablespoon unsweetened cocoa powder,Meringue Mushrooms,https://www.allrecipes.com/recipe/40322/meringue-mushrooms/,egg cream tartar vanilla sugar cocoa
French,"3 large whole russet potatoes 2 tablespoons high-heat-resistant vegetable oil, such as grapeseed oil salt and ground black pepper to taste 3 tablespoons butter 4 sprigs thyme, plus more for garnish",Fondant Potatoes,https://www.allrecipes.com/recipe/233295/fondant-potatoes/,russet potatoe oil oil salt pepper sprig thyme
French,"2 slices whole wheat bread 2 tablespoons butter, softened 1 tablespoon sour cream 2 slices Swiss cheese 1 thick slice deli cooked chicken breast meat",Grilled Chicken Cordon Bleu Sandwiches,https://www.allrecipes.com/recipe/15266/grilled-chicken-cordon-bleu-sandwiches/,wheat butter cream breast meat
French,1 cup all-purpose flour 1 cup milk 1 egg,Crepes,https://www.allrecipes.com/recipe/16216/crepes/,flour milk egg
French,"1/4 cup all-purpose flour, or as needed salt and black pepper to taste 2 eggs, beaten 1 tablespoon white sugar 1 tablespoon grated Parmesan cheese 2 tablespoons olive oil 4 skinless, boneless chicken breast halves 1/4 cup butter 2 teaspoons minced garlic 1/4 cup dry sherry 1/4 cup lemon juice",Chicken French Rochester Ny Style,https://www.allrecipes.com/recipe/213487/chicken-french-rochester-ny-style/,flour salt pepper egg sugar oil boneless chicken breast butter sherry lemon juice
French,"4 skinless, boneless chicken breast halves 4 slices ham 4 slices Swiss cheese 1 cup all-purpose flour 1 teaspoon salt 1/2 teaspoon ground black pepper 1/2 teaspoon paprika 2 eggs, beaten 1/3 cup milk 1 cup dry bread crumbs 1/4 cup olive oil 1 (10.75 ounce) can condensed cream of mushroom soup 1/2 pound fresh mushrooms, sliced 1/4 teaspoon garlic powder 1/8 teaspoon curry powder 1/4 cup white wine 1/2 cup sour cream",Saucy Chicken Cordon Bleu,https://www.allrecipes.com/recipe/9005/saucy-chicken-cordon-bleu/,boneless chicken breast flour pepper egg milk bread oil cream mushroom mushroom wine cream
French,"Pastry: 1 1/3 cups all-purpose flour 1 pinch salt 1/2 cup butter, softened 1 egg yolk 3 tablespoons cold water, or as needed Frangipane: 1/2 cup butter, softened 1/2 cup white sugar 1 egg, beaten 1 egg yolk 1 tablespoon apple brandy 2/3 cup ground almonds 2 tablespoons all-purpose flour 4 medium sweet apples - peeled, cored, halved and thinly sliced 1 teaspoon white sugar for decoration",French Apple Tart Tarte De Pommes A La Normande,https://www.allrecipes.com/recipe/77874/french-apple-tart-tarte-de-pommes-a-la-normande/,butter egg frangipane butter sugar egg egg apple sweet apple sugar decoration
French,1 cup white rice 2 cups chicken stock 1 1/2 teaspoons herbes de Provence 1 pinch sea salt,Rice With Herbes De Provence,https://www.allrecipes.com/recipe/89408/rice-with-herbes-de-provence/,rice stock provence sea salt
French,1/4 cup coarsely crushed black peppercorns 4 (6 ounce) 1 1/2 inch thick filet mignon steaks salt to taste 1 tablespoon butter 1 teaspoon olive oil 1/3 cup beef broth,Filet Mignons With Pepper Cream Sauce,https://www.allrecipes.com/recipe/213505/filet-mignons-with-pepper-cream-sauce/,peppercorn fillet mignon steak butter oil beef
French,"1/4 cup red wine vinegar 2 tablespoons Dijon mustard 1 teaspoon dried oregano 1 clove garlic, minced 1/2 teaspoon kosher salt 1/4 teaspoon ground black pepper 1/2 cup olive oil",The Best Lemon Vinaigrette,https://www.allrecipes.com/recipe/236780/the-best-lemon-vinaigrette/,wine vinegar clove garlic kosher pepper oil
French,2 cups semisweet chocolate chips 2 cups heavy cream,Pro Ganache,https://www.allrecipes.com/recipe/76330/pro-ganache/,chip cream
French,"1 bunch fresh asparagus spears, trimmed 2 tablespoons olive oil 1 tablespoon dried Herbes de Provence",Roasted Asparagus With Herbes De Provence,https://www.allrecipes.com/recipe/149984/roasted-asparagus-with-herbes-de-provence/,asparagus oil provence
French,"2 pounds skinless, boneless chicken breast halves, cut into chunks 1 onion, quartered and thinly sliced 2 large cloves garlic, minced 1/4 cup chopped fresh parsley 1/2 teaspoon salt 1/4 teaspoon black pepper 2 (15 ounce) cans cannellini beans, drained and rinsed 1 pound turkey kielbasa, cut into 1/2-inch slices",Slow Cooker Cassoulet,https://www.allrecipes.com/recipe/213758/slow-cooker-cassoulet/,chicken breast chunk onion clove parsley pepper bean turkey kielbasa
French,2 cups heavy cream,Chef Johns Creme Fraiche,https://www.allrecipes.com/recipe/222387/chef-johns-creme-fraiche/,cream
French,"1 1/4 teaspoons active dry yeast 3 tablespoons warm water (110 degrees F/45 degrees C) 1 teaspoon white sugar 1 3/4 cups all-purpose flour 2 teaspoons white sugar 1 1/2 teaspoons salt 2/3 cup warm milk 2 tablespoons vegetable oil 2/3 cup unsalted butter, chilled 1 egg",Croissants,https://www.allrecipes.com/recipe/6916/croissants/,yeas sugar milk oil butter egg
French,"1/2 cup white sugar 5 tablespoons all-purpose flour 1 pinch salt 2 cups milk 2 egg yolks, beaten 1 teaspoon vanilla extract 1/2 cup shortening 1 cup water 1 cup all-purpose flour 1 pinch salt",Cream Puffs I,https://www.allrecipes.com/recipe/19033/cream-puffs-i/,sugar milk egg yolk vanilla flour salt
French,"1 tablespoon butter 4 whole boneless, skinless chicken breast, cubed 1/4 cup white wine 1 (10.75 ounce) can condensed cream of chicken soup 1/2 cup shredded Swiss cheese",Skillet Chicken Cordon Bleu,https://www.allrecipes.com/recipe/8621/skillet-chicken-cordon-bleu/,butter boneless chicken breast cream chicken cheese
French,"2/3 cup ketchup 3/4 cup white sugar 1/2 cup white wine vinegar 1/2 cup vegetable oil 1 small onion, quartered 2 teaspoons paprika",Aunt Bettys French Dressing,https://www.allrecipes.com/recipe/14298/aunt-bettys-french-dressing/,sugar wine vinegar oil onion
French,"1 tablespoon vegetable oil 1 (4 pound) whole chicken, cut into pieces 1 teaspoon salt 1/4 teaspoon ground black pepper 1/4 teaspoon garlic powder 1 1/2 cups red wine 1 1/2 cups chicken stock 1 onion 1 tablespoon cornstarch",Easy Coq Au Vin,https://www.allrecipes.com/recipe/17021/easy-coq-au-vin/,oil chicken pepper stock onion cornstarch
French,1 cup all-purpose flour 1 egg,Real French Crepes,https://www.allrecipes.com/recipe/17571/real-french-crepes/,flour egg
